,Actions,Description,Access level,Resource types (*required),Condition keys,Dependent actions
0,BatchCreateVolumeSnapshotGroupForMgn [permission only],Grants permission to create volume snapshot group,Write,SourceServerResource*,,
1,BatchDeleteSnapshotRequestForMgn [permission only],Grants permission to batch delete snapshot request,Write,,,
2,ChangeServerLifeCycleState,Grants permission to change source server life cycle state,Write,SourceServerResource*,,
3,CreateReplicationConfigurationTemplate,Grants permission to create replication configuration template,Write,,aws:RequestTag/${TagKey}  aws:TagKeys,
4,CreateVcenterClientForMgn [permission only],Grants permission to create vcenter client,Write,,aws:RequestTag/${TagKey}  aws:TagKeys,
5,DeleteJob,Grants permission to delete job,Write,JobResource*,,
6,DeleteReplicationConfigurationTemplate,Grants permission to delete replication configuration template,Write,ReplicationConfigurationTemplateResource*,,
7,DeleteSourceServer,Grants permission to delete source server,Write,SourceServerResource*,,
8,DeleteVcenterClient,Grants permission to delete vcenter client,Write,VcenterClientResource*,,
9,DescribeJobLogItems,Grants permission to describe job log items,Read,JobResource*,,
10,DescribeJobs,Grants permission to describe jobs,List,,,
11,DescribeReplicationConfigurationTemplates,Grants permission to describe replication configuration template,List,,,
12,DescribeReplicationServerAssociationsForMgn [permission only],Grants permission to describe replication server associations,Read,,,
13,DescribeSnapshotRequestsForMgn [permission only],Grants permission to describe snapshots requests,Read,,,
14,DescribeSourceServers,Grants permission to describe source servers,List,,,
15,DescribeVcenterClients,Grants permission to describe vcenter clients,List,,,
16,DisconnectFromService,Grants permission to disconnect source server from service,Write,SourceServerResource*,,
17,FinalizeCutover,Grants permission to finalize cutover,Write,SourceServerResource*,,
18,GetAgentCommandForMgn [permission only],Grants permission to get agent command,Read,SourceServerResource*,,
19,GetAgentConfirmedResumeInfoForMgn [permission only],Grants permission to get agent confirmed resume info,Read,SourceServerResource*,,
20,GetAgentInstallationAssetsForMgn [permission only],Grants permission to get agent installation assets,Read,,,
21,GetAgentReplicationInfoForMgn [permission only],Grants permission to get agent replication info,Read,SourceServerResource*,,
22,GetAgentRuntimeConfigurationForMgn [permission only],Grants permission to get agent runtime configuration,Read,SourceServerResource*,,
23,GetAgentSnapshotCreditsForMgn [permission only],Grants permission to get agent snapshots credits,Read,SourceServerResource*,,
24,GetChannelCommandsForMgn [permission only],Grants permission to get channel commands,Read,,,
25,GetLaunchConfiguration,Grants permission to get launch configuration,Read,SourceServerResource*,,
26,GetReplicationConfiguration,Grants permission to get replication configuration,Read,SourceServerResource*,,
27,GetVcenterClientCommandsForMgn [permission only],Grants permission to get vcenter client commands,Read,VcenterClientResource*,,
28,InitializeService,Grants permission to initialize service,Write,,,iam:AddRoleToInstanceProfile  iam:CreateInstanceProfile  iam:CreateServiceLinkedRole  iam:GetInstanceProfile
29,ListTagsForResource,Grants permission to list tags for a resource,Read,,,
30,MarkAsArchived,Grants permission to mark source server as archived,Write,SourceServerResource*,,
31,NotifyAgentAuthenticationForMgn [permission only],Grants permission to notify agent authentication,Write,SourceServerResource*,,
32,NotifyAgentConnectedForMgn [permission only],Grants permission to notify agent is connected,Write,SourceServerResource*,,
33,NotifyAgentDisconnectedForMgn [permission only],Grants permission to notify agent is disconnected,Write,SourceServerResource*,,
34,NotifyAgentReplicationProgressForMgn [permission only],Grants permission to notify agent replication progress,Write,SourceServerResource*,,
35,NotifyVcenterClientStartedForMgn [permission only],Grants permission to notify vcenter client started,Write,VcenterClientResource*,,
36,RegisterAgentForMgn [permission only],Grants permission to register agent,Write,,aws:RequestTag/${TagKey}  aws:TagKeys,
37,RetryDataReplication,Grants permission to retry replication,Write,SourceServerResource*,,
38,SendAgentLogsForMgn [permission only],Grants permission to send agent logs,Write,SourceServerResource*,,
39,SendAgentMetricsForMgn [permission only],Grants permission to send agent metrics,Write,SourceServerResource*,,
40,SendChannelCommandResultForMgn [permission only],Grants permission to send channel command result,Write,,,
41,SendClientLogsForMgn [permission only],Grants permission to send client logs,Write,,,
42,SendClientMetricsForMgn [permission only],Grants permission to send client metrics,Write,,,
43,SendVcenterClientCommandResultForMgn [permission only],Grants permission to send vcenter client command result,Write,VcenterClientResource*,,
44,SendVcenterClientLogsForMgn [permission only],Grants permission to send vcenter client logs,Write,VcenterClientResource*,,
45,SendVcenterClientMetricsForMgn [permission only],Grants permission to send vcenter client metrics,Write,VcenterClientResource*,,
46,StartCutover,Grants permission to start cutover,Write,SourceServerResource*,,ec2:AttachVolume  ec2:AuthorizeSecurityGroupEgress  ec2:AuthorizeSecurityGroupIngress  ec2:CreateLaunchTemplate  ec2:CreateLaunchTemplateVersion  ec2:CreateSecurityGroup  ec2:CreateSnapshot  ec2:CreateTags  ec2:CreateVolume  ec2:DeleteLaunchTemplateVersions  ec2:DeleteSnapshot  ec2:DeleteVolume  ec2:DescribeAccountAttributes  ec2:DescribeAvailabilityZones  ec2:DescribeImages  ec2:DescribeInstanceAttribute  ec2:DescribeInstanceStatus  ec2:DescribeInstanceTypes  ec2:DescribeInstances  ec2:DescribeLaunchTemplateVersions  ec2:DescribeLaunchTemplates  ec2:DescribeSecurityGroups  ec2:DescribeSnapshots  ec2:DescribeSubnets  ec2:DescribeVolumes  ec2:DetachVolume  ec2:ModifyInstanceAttribute  ec2:ModifyLaunchTemplate  ec2:ReportInstanceStatus  ec2:RevokeSecurityGroupEgress  ec2:RunInstances  ec2:StartInstances  ec2:StopInstances  ec2:TerminateInstances  iam:PassRole  mgn:ListTagsForResource
47,StartCutover,Grants permission to start cutover,Write,,aws:RequestTag/${TagKey}  aws:TagKeys,
48,StartReplication,Grants permission to start replication,Write,SourceServerResource*,,
49,StartTest,Grants permission to start test,Write,SourceServerResource*,,ec2:AttachVolume  ec2:AuthorizeSecurityGroupEgress  ec2:AuthorizeSecurityGroupIngress  ec2:CreateLaunchTemplate  ec2:CreateLaunchTemplateVersion  ec2:CreateSecurityGroup  ec2:CreateSnapshot  ec2:CreateTags  ec2:CreateVolume  ec2:DeleteLaunchTemplateVersions  ec2:DeleteSnapshot  ec2:DeleteVolume  ec2:DescribeAccountAttributes  ec2:DescribeAvailabilityZones  ec2:DescribeImages  ec2:DescribeInstanceAttribute  ec2:DescribeInstanceStatus  ec2:DescribeInstanceTypes  ec2:DescribeInstances  ec2:DescribeLaunchTemplateVersions  ec2:DescribeLaunchTemplates  ec2:DescribeSecurityGroups  ec2:DescribeSnapshots  ec2:DescribeSubnets  ec2:DescribeVolumes  ec2:DetachVolume  ec2:ModifyInstanceAttribute  ec2:ModifyLaunchTemplate  ec2:ReportInstanceStatus  ec2:RevokeSecurityGroupEgress  ec2:RunInstances  ec2:StartInstances  ec2:StopInstances  ec2:TerminateInstances  iam:PassRole  mgn:ListTagsForResource
50,StartTest,Grants permission to start test,Write,,aws:RequestTag/${TagKey}  aws:TagKeys,
51,TagResource,Grants permission to assign a resource tag,Tagging,,aws:RequestTag/${TagKey}  mgn:CreateAction  aws:TagKeys,
52,TerminateTargetInstances,Grants permission to terminate target instances,Write,SourceServerResource*,,ec2:DeleteVolume  ec2:DescribeInstances  ec2:DescribeVolumes  ec2:TerminateInstances
53,TerminateTargetInstances,Grants permission to terminate target instances,Write,,aws:RequestTag/${TagKey}  aws:TagKeys,
54,UntagResource,Grants permission to untag a resource,Tagging,,aws:TagKeys,
55,UpdateAgentBacklogForMgn [permission only],Grants permission to update agent backlog,Write,SourceServerResource*,,
56,UpdateAgentConversionInfoForMgn [permission only],Grants permission to update agent conversion info,Write,SourceServerResource*,,
57,UpdateAgentReplicationInfoForMgn [permission only],Grants permission to update agent replication info,Write,SourceServerResource*,,
58,UpdateAgentReplicationProcessStateForMgn [permission only],Grants permission to update agent replication process state,Write,SourceServerResource*,,
59,UpdateAgentSourcePropertiesForMgn [permission only],Grants permission to update agent source properties,Write,SourceServerResource*,,
60,UpdateLaunchConfiguration,Grants permission to update launch configuration,Write,SourceServerResource*,,
61,UpdateReplicationConfiguration,Grants permission to update replication configuration,Write,SourceServerResource*,,
62,UpdateReplicationConfigurationTemplate,Grants permission to update replication configuration template,Write,ReplicationConfigurationTemplateResource*,,
63,UpdateSourceServerReplicationType,Grants permission to update source server replication type,Write,SourceServerResource*,,
